{
  "workflow_name": "n8n",
  "round_id": "real-round-20260310-01",
  "evidence_pack_ref": "collector/xhs_evidence_pack.json",
  "knowledge_digest_ref": "knowledge_digest.json",
  "platform_fit": {
    "declared_path": "event/webhook orchestration",
    "why_this_platform": "n8n 适合做采集、归一化、通知、回写和多系统编排的确定性自动化。",
    "known_limits": [
      "不适合把整段内容脑力推理硬塞进自动化画布",
      "凭证、触发和回写链路需要更严格验真"
    ],
    "non_fit_warning": "不适合单独承载完整内容推理，但适合作为编排底座。"
  },
  "topic_candidates": [],
  "reasoned_ranking": [],
  "sample_post_plan": {
    "selected_candidate_id": "",
    "cover_hook": "",
    "slide_outline": [],
    "cta": "",
    "visual_notes": "",
    "negative_guards": []
  },
  "verification_plan": {
    "success_signals": [],
    "failure_signals": [],
    "review_method": "",
    "follow_up_tasks": []
  }
}
