{
  "workflow_name": "feishu",
  "round_id": "real-round-20260310-01",
  "evidence_pack_ref": "collector/xhs_evidence_pack.json",
  "knowledge_digest_ref": "knowledge_digest.json",
  "platform_fit": {
    "declared_path": "knowledge-centric workflow",
    "why_this_platform": "Feishu 适合承载知识库、状态流、回写和组织协同闭环。",
    "known_limits": [
      "外部生态灵活度不如 n8n",
      "某些集成仍需 webhook 或补脚本"
    ],
    "non_fit_warning": ""
  },
  "topic_candidates": [],
  "reasoned_ranking": [],
  "sample_post_plan": {
    "selected_candidate_id": "",
    "cover_hook": "",
    "slide_outline": [],
    "cta": "",
    "visual_notes": "",
    "negative_guards": []
  },
  "verification_plan": {
    "success_signals": [],
    "failure_signals": [],
    "review_method": "",
    "follow_up_tasks": []
  }
}
