{
  "workflow_name": "replace-me",
  "round_id": "replace-me",
  "evidence_pack_ref": "collector/xhs_evidence_pack.json",
  "knowledge_digest_ref": "knowledge_digest.json",
  "platform_fit": {
    "declared_path": "",
    "why_this_platform": "",
    "known_limits": [],
    "non_fit_warning": ""
  },
  "topic_candidates": [],
  "reasoned_ranking": [],
  "sample_post_plan": {
    "selected_candidate_id": "",
    "cover_hook": "",
    "slide_outline": [],
    "cta": "",
    "visual_notes": "",
    "negative_guards": []
  },
  "verification_plan": {
    "success_signals": [],
    "failure_signals": [],
    "review_method": "",
    "follow_up_tasks": []
  }
}
